"DESCRIPTION","DURATION IN MS","NAME","PARENT SUITE","START TIME","STATUS","STOP TIME","SUB SUITE","SUITE","TEST CLASS","TEST METHOD"
"","8086","TC03 - Create task successfully from sidebar","chromium","Thu Mar 12 16:58:00 UTC 2026","passed","Thu Mar 12 16:58:08 UTC 2026","Sidebar tests","ui/sidebar.spec.ts","",""
"","7920","TC04 - Delete task successfully","chromium","Thu Mar 12 16:58:16 UTC 2026","passed","Thu Mar 12 16:58:24 UTC 2026","Task Management","ui/today.spec.ts","",""
"","7966","should be able to create a task correctly","chromium","Thu Mar 12 16:58:08 UTC 2026","passed","Thu Mar 12 16:58:16 UTC 2026","Task Management","ui/today.spec.ts","",""
"","1777","should display the correct error message for invalid credentials","chromium","Thu Mar 12 16:57:58 UTC 2026","passed","Thu Mar 12 16:58:00 UTC 2026","Login tests","ui/login.spec.ts","",""
"","1261","should be able to create a task via API correctly for today","chromium","Thu Mar 12 16:57:51 UTC 2026","passed","Thu Mar 12 16:57:53 UTC 2026","API - Create Task","api/create.spec.ts","",""
"","5612","Should dismiss add task modal","chromium","Thu Mar 12 16:58:24 UTC 2026","passed","Thu Mar 12 16:58:29 UTC 2026","Page Functionality","ui/today.spec.ts","",""
"","5060","should be able to login correctly","chromium","Thu Mar 12 16:57:53 UTC 2026","passed","Thu Mar 12 16:57:58 UTC 2026","Login tests","ui/login.spec.ts","",""
